<?xml version="1.0" encoding="UTF-8"?>
<tasks xmlns="http://composestar.sourceforge.net/schema/TASMAN" xmlns:xsi="http://www.w3.org/2001/XMLSchema-instance"
	xsi:schemaLocation="http://composestar.sourceforge.net/schema/TASMAN ../../ComposestarCORE/src/Composestar/Core/TASMAN/Xml/TASMANConfig.xsd ">
	<module class="Composestar.Core.COPPER3.COPPER" />
	<module class="Composestar.Core.EMBEX.EMBEX" />
	<module class="Composestar.CwC.COMP.PreProcess" />
	<module class="Composestar.CwC.TYM.Harvester.TypeHarvester" />
	<module class="Composestar.CwC.TYM.Collector.LangModelConverter" />
	<module class="Composestar.Core.REXREF2.RexRef" />
	<module class="Composestar.CwC.LOLA.CwCLOLA" />
	<module class="Composestar.Core.CHKREP2.Check" />
	<module class="Composestar.Core.SANE2.Imposer" />
	<module class="Composestar.Core.FILTH2.FILTH" />
	<module class="Composestar.Core.DEPART.Departure" />
	<module class="Composestar.Core.FIRE2.preprocessing.Preprocessor" />
	<module class="Composestar.Core.CORE2.Core" />
	<module class="Composestar.Core.SIGN2.Sign" />
	<module class="Composestar.Core.DIGGER2.DIGGER" />
	<module class="Composestar.Core.INLINE.lowlevel.ModelBuilder" />
	<module class="Composestar.CwC.WEAVER.CwCWeaver" />
	<module class="Composestar.Core.SECRET3.SECRET" />
	<!-- CwC.LAMA is not very serializable <module class="Composestar.Core.INCRE.INCRESerializer" />-->
</tasks>