<?xml version="1.0" encoding="UTF-8"?>
<tasks xmlns="http://composestar.sourceforge.net/schema/TASMAN" xmlns:xsi="http://www.w3.org/2001/XMLSchema-instance"
	xsi:schemaLocation="http://composestar.sourceforge.net/schema/TASMAN ../../ComposestarCORE/src/Composestar/Core/TASMAN/Xml/TASMANConfig.xsd ">
	<module class="Composestar.Core.COPPER3.COPPER" />
	<module class="Composestar.Core.EMBEX.EMBEX" />
	<module class="Composestar.Core.DUMMER.DummyManager" />
	<module class="Composestar.Java.TYM.TypeHarvester.JavaHarvestRunner" />
	<module class="Composestar.Java.TYM.TypeCollector.JavaCollectorRunner" />
	<module class="Composestar.Java.TYM.TypeCollector.AnnotationCollector" />
	<module class="Composestar.Core.REXREF2.RexRef" />
	<module class="Composestar.Java.LOLA.JavaLOLA" />
	<!-- <module class="Composestar.Core.FITER.FITER" />  --><!-- disabled for now -->
	<parallel perprocessor="1">
		<module class="Composestar.Core.CHKREP2.Check" />
	</parallel>
	<module class="Composestar.Core.SANE2.Imposer" />
	<module class="Composestar.Core.FILTH2.FILTH" />
	<module class="Composestar.Core.DEPART.Departure" />
	<module class="Composestar.Core.FIRE2.preprocessing.Preprocessor" />
	<module class="Composestar.Core.CORE2.Core" />
	<module class="Composestar.Core.SIGN2.Sign" />
	<parallel perprocessor="1">
		<!-- 
		<module class="Composestar.Core.DIGGER2.DIGGER" />
		<module class="Composestar.Core.CKRET.CKRET" />
	 -->
		<sequential>
			<module class="Composestar.Java.TYM.SignatureTransformer.JavaSignatureTransformer" />
			<module class="Composestar.Core.RECOMA.RealSourceManager" />
			<module class="Composestar.Java.CONE.JavaRepositorySerializer" />
			<module class="Composestar.Java.WEAVER.JavaWeaver" />
			<module class="Composestar.Java.BACO.JavaBACO" />
		</sequential>
	</parallel>
	<!-- 
	<module class="Composestar.Core.INCRE.INCRESerializer" />
	 -->
</tasks>
