<?xml version="1.0" encoding="UTF-8"?>
<tasks xmlns="http://composestar.sourceforge.net/schema/TASMAN" xmlns:xsi="http://www.w3.org/2001/XMLSchema-instance"
	xsi:schemaLocation="http://composestar.sourceforge.net/schema/TASMAN ../../ComposestarCORE/src/Composestar/Core/TASMAN/Xml/TASMANConfig.xsd ">
	<module class="Composestar.Core.COPPER2.COPPER" />
	<module class="Composestar.Core.EMBEX.EMBEX" />
	<module class="Composestar.Core.DUMMER.DummyManager" />
	<module class="Composestar.DotNET.TYM.TypeHarvester.DotNETHarvestRunner" />
	<module class="Composestar.DotNET.TYM.TypeCollector.DotNETCollectorRunner" />
	<module class="Composestar.DotNET.TYM.TypeCollector.AttributeCollector" />
	<module class="Composestar.Core.REXREF.ParumREXREF" />
	<module class="Composestar.DotNET.LOLA.DotNETLOLA" />
	<module class="Composestar.Core.REXREF.Main" />
	<module class="Composestar.Core.FITER.FITER" />
	<module class="Composestar.Core.CHKREP2.Check" />
	<module class="Composestar.Core.SANE.SANE" />
	<module class="Composestar.Core.FILTH2.FILTH" />
	<module class="Composestar.Core.FIRE2.preprocessing.Preprocessor" />
	<module class="Composestar.Core.CORE2.Core" />
	<module class="Composestar.Core.SIGN2.Sign" />
	<module class="Composestar.Core.DIGGER2.DIGGER" />
	<module class="Composestar.DotNET.ASTRA.ASTRA" />
	<module class="Composestar.Core.RECOMA.RealSourceManager" />
	<module class="Composestar.DotNET.CONE.DotNETWeaveFileGenerator" />
	<module class="Composestar.DotNET.ILICIT.ILICIT" />
	<module class="Composestar.DotNET.SEMTEX.DotNETSemTexRunner" />
	<module class="Composestar.DotNET.SEMTEX.DotNETSemTexCollector" />
	<module class="Composestar.Core.CKRET.CKRET" />
	<module class="Composestar.DotNET.CONE.DotNETRepositorySerializer" />
	<module class="Composestar.DotNET.BACO.DotNETBACO" />
	<module class="Composestar.Core.INCRE.INCRESerializer" />
</tasks>
